<?xml version="1.0" encoding="UTF-8" standalone="yes"?>
<GUI xmlns="GUI"
     xmlns:xsi="http://www.w3.org/2001/XMLSchema-instance"
     xsi:schemaLocation="GUIServer.xsd">
	<Version>1.0.0</Version>
	<SessionId></SessionId>
	<Type>
		<ChangeGUI>
			<Operation>
				<AddElement>
					<WindowID>window2</WindowID>
						<Element>
							<ID>elementklick1-1</ID>
							<Ebene>3</Ebene>
							<Zeichnungsnummer>1</Zeichnungsnummer>
							<Position>
								<X-Position>0</X-Position>
								<Y-Position>530</Y-Position>
								<Width>75</Width>
								<Height>20</Height>
							</Position>
							<Elementtyp>
								<Klick>
									<ActiveImage>
										<URL>http://localhost:8080/CASS/GuiElementSeiten/Klick/Menu1/Menu1-1Active.html</URL>
									</ActiveImage>
									<InactiveImage>
										<URL>http://localhost:8080/CASS/GuiElementSeiten/Klick/Menu1/Menu1-1Inactive.html</URL>
									</InactiveImage>
									<MouseOverImage>
										<URL>http://localhost:8080/CASS/GuiElementSeiten/Klick/Menu1/Menu1-1MouseOver.html</URL>
									</MouseOverImage>
									<StartState>Active</StartState>
								</Klick>
							</Elementtyp>
						</Element>
				</AddElement>
			</Operation>
			<Operation>
				<AddElement>
					<WindowID>window2</WindowID>
						<Element>
							<ID>elementklick1-2</ID>
							<Ebene>3</Ebene>
							<Zeichnungsnummer>2</Zeichnungsnummer>
							<Position>
								<X-Position>0</X-Position>
								<Y-Position>510</Y-Position>
								<Width>75</Width>
								<Height>20</Height>
							</Position>
							<Elementtyp>
								<Klick>
									<ActiveImage>
										<URL>http://localhost:8080/CASS/GuiElementSeiten/Klick/Menu1/Menu1-2Active.html</URL>
									</ActiveImage>
									<InactiveImage>
										<URL>http://localhost:8080/CASS/GuiElementSeiten/Klick/Menu1/Menu1-2Inactive.html</URL>
									</InactiveImage>
									<MouseOverImage>
										<URL>http://localhost:8080/CASS/GuiElementSeiten/Klick/Menu1/Menu1-2MouseOver.html</URL>
									</MouseOverImage>
									<StartState>Active</StartState>
								</Klick>
							</Elementtyp>
						</Element>
				</AddElement>
			</Operation>
		</ChangeGUI>
	</Type>
</GUI>