<?xml version="1.0" encoding="UTF-8" standalone="yes"?>
<GUI xmlns="GUI"
     xmlns:xsi="http://www.w3.org/2001/XMLSchema-instance"
     xsi:schemaLocation="GUIServer.xsd">
	<Version>1.0.0</Version>
	<SessionId></SessionId>
	<Type>
		<InitialGUI>
			<Windows>
				<Window>
					<ID>Zeitangabe</ID>
					<Title>Zeitangabe</Title>
					<Position>
						<X-Position>100</X-Position>
						<Y-Position>100</Y-Position>
						<Width>450</Width>
						<Height>150</Height>
					</Position>
					<Elemente>
						<Element>
							<ID>StundeZehnerstelle</ID>
							<Ebene>1</Ebene>
							<Zeichnungsnummer>1</Zeichnungsnummer>
							<Position>
								<X-Position>0</X-Position>
								<Y-Position>0</Y-Position>
								<Width>50</Width>
								<Height>100</Height>
							</Position>
							<Elementtyp>
								<Content>
									<URL>http://localhost:8080/clapsesy/GuiElementSeiten/Ziffern/Ziffer0.html</URL>
								</Content>
							</Elementtyp>
						</Element>
						<Element>
							<ID>StundeEinerstelle</ID>
							<Ebene>1</Ebene>
							<Zeichnungsnummer>2</Zeichnungsnummer>
							<Position>
								<X-Position>50</X-Position>
								<Y-Position>0</Y-Position>
								<Width>50</Width>
								<Height>100</Height>
							</Position>
							<Elementtyp>
								<Content>
									<URL>http://localhost:8080/clapsesy/GuiElementSeiten/Ziffern/Ziffer0.html</URL>
								</Content>
							</Elementtyp>
						</Element>
						<Element>
							<ID>Doppelpunkt1</ID>
							<Ebene>1</Ebene>
							<Zeichnungsnummer>3</Zeichnungsnummer>
							<Position>
								<X-Position>100</X-Position>
								<Y-Position>0</Y-Position>
								<Width>50</Width>
								<Height>100</Height>
							</Position>
							<Elementtyp>
								<Content>
									<URL>http://localhost:8080/clapsesy/GuiElementSeiten/Ziffern/Doppelpunkt.html</URL>
								</Content>
							</Elementtyp>
						</Element>
						<Element>
							<ID>MinuteZehnerstelle</ID>
							<Ebene>1</Ebene>
							<Zeichnungsnummer>4</Zeichnungsnummer>
							<Position>
								<X-Position>150</X-Position>
								<Y-Position>0</Y-Position>
								<Width>50</Width>
								<Height>100</Height>
							</Position>
							<Elementtyp>
								<Content>
									<URL>http://localhost:8080/clapsesy/GuiElementSeiten/Ziffern/Ziffer0.html</URL>
								</Content>
							</Elementtyp>
						</Element>
						<Element>
							<ID>MinuteEinerstelle</ID>
							<Ebene>1</Ebene>
							<Zeichnungsnummer>5</Zeichnungsnummer>
							<Position>
								<X-Position>200</X-Position>
								<Y-Position>0</Y-Position>
								<Width>50</Width>
								<Height>100</Height>
							</Position>
							<Elementtyp>
								<Content>
									<URL>http://localhost:8080/clapsesy/GuiElementSeiten/Ziffern/Ziffer0.html</URL>
								</Content>
							</Elementtyp>
						</Element>
						<Element>
							<ID>Doppelpunkt2</ID>
							<Ebene>1</Ebene>
							<Zeichnungsnummer>6</Zeichnungsnummer>
							<Position>
								<X-Position>250</X-Position>
								<Y-Position>0</Y-Position>
								<Width>50</Width>
								<Height>100</Height>
							</Position>
							<Elementtyp>
								<Content>
									<URL>http://localhost:8080/clapsesy/GuiElementSeiten/Ziffern/Doppelpunkt.html</URL>
								</Content>
							</Elementtyp>
						</Element>
						<Element>
							<ID>SekundeZehnerstelle</ID>
							<Ebene>1</Ebene>
							<Zeichnungsnummer>7</Zeichnungsnummer>
							<Position>
								<X-Position>300</X-Position>
								<Y-Position>0</Y-Position>
								<Width>50</Width>
								<Height>100</Height>
							</Position>
							<Elementtyp>
								<Content>
									<URL>http://localhost:8080/clapsesy/GuiElementSeiten/Ziffern/Ziffer0.html</URL>
								</Content>
							</Elementtyp>
						</Element>
						<Element>
							<ID>SekundeEinerstelle</ID>
							<Ebene>1</Ebene>
							<Zeichnungsnummer>8</Zeichnungsnummer>
							<Position>
								<X-Position>350</X-Position>
								<Y-Position>0</Y-Position>
								<Width>50</Width>
								<Height>100</Height>
							</Position>
							<Elementtyp>
								<Content>
									<URL>http://localhost:8080/clapsesy/GuiElementSeiten/Ziffern/Ziffer0.html</URL>
								</Content>
							</Elementtyp>
						</Element>
					</Elemente>
				</Window>
			</Windows>
		</InitialGUI>
	</Type>
</GUI>