<?xml version="1.0" encoding="UTF-8" standalone="yes"?>
<GUI xmlns="GUI"
     xmlns:xsi="http://www.w3.org/2001/XMLSchema-instance"
     xsi:schemaLocation="GUIServer.xsd">
	<Version>1.0.0</Version>
	<SessionId></SessionId>
	<Type>
		<ChangeGUI>
			<Operation>
				<RemoveElement>
					<WindowID>window2</WindowID>
					<ElementID>element6</ElementID>
				</RemoveElement>
			</Operation>
		</ChangeGUI>
	</Type>
</GUI>