<?xml version="1.0" encoding="UTF-8" standalone="yes"?>
<GUI xmlns="GUI"
     xmlns:xsi="http://www.w3.org/2001/XMLSchema-instance"
     xsi:schemaLocation="GUIServer.xsd">
	<Version>1.0.0</Version>
	<SessionId></SessionId>
	<Type>
		<ChangeGUI>
			<Operation>
				<AddWindow>
					<Window>
						<ID>window3</ID>
						<Title>title3</Title>
						<Position>
							<X-Position>300</X-Position>
							<Y-Position>44</Y-Position>
							<Width>270</Width>
							<Height>500</Height>
						</Position>
						<Elemente>
							<Element>
								<ID>element1</ID>
								<Ebene>2</Ebene>
								<Zeichnungsnummer>1</Zeichnungsnummer>
								<Position>
									<X-Position>0</X-Position>
									<Y-Position>0</Y-Position>
									<Width>250</Width>
									<Height>100</Height>
								</Position>
								<Elementtyp>
									<Button>
										<ActiveImage>
											<URL>http://localhost:8080/clapsesy/GuiElementSeiten/ButtonActive.html</URL>
										</ActiveImage>
										<InactiveImage>
											<URL>http://localhost:8080/clapsesy/GuiElementSeiten/ButtonInactive.html</URL>
										</InactiveImage>
										<MouseOverImage>
											<URL>http://localhost:8080/clapsesy/GuiElementSeiten/ButtonMouseOver.html</URL>
										</MouseOverImage>
										<PressedImage>
											<URL>http://localhost:8080/clapsesy/GuiElementSeiten/ButtonPressed.html</URL>
										</PressedImage>
										<StartState>Active</StartState>
									</Button>
								</Elementtyp>
							</Element>
							<Element>
								<ID>element2</ID>
								<Ebene>2</Ebene>
								<Zeichnungsnummer>2</Zeichnungsnummer>
								<Position>
									<X-Position>0</X-Position>
									<Y-Position>100</Y-Position>
									<Width>250</Width>
									<Height>100</Height>
								</Position>
								<Elementtyp>
									<Select>
										<ActiveDeselectedImage>
											<URL>http://localhost:8080/clapsesy/GuiElementSeiten/SelectActiveDeselected.html</URL>
										</ActiveDeselectedImage>
										<ActiveSelectedImage>
											<URL>http://localhost:8080/clapsesy/GuiElementSeiten/SelectActiveSelected.html</URL>
										</ActiveSelectedImage>
										<ActiveDeselectedMouseOverImage>
											<URL>http://localhost:8080/clapsesy/GuiElementSeiten/SelectActiveDeselectedMouseOver.html</URL>
										</ActiveDeselectedMouseOverImage>
										<ActiveSelectedMouseOverImage>
											<URL>http://localhost:8080/clapsesy/GuiElementSeiten/SelectActiveSelectedMouseOver.html</URL>
										</ActiveSelectedMouseOverImage>
										<InactiveDeselectedImage>
											<URL>http://localhost:8080/clapsesy/GuiElementSeiten/SelectInactiveDeselected.html</URL>
										</InactiveDeselectedImage>
										<InactiveSelectedImage>
											<URL>http://localhost:8080/clapsesy/GuiElementSeiten/SelectInactiveSelected.html</URL>
										</InactiveSelectedImage>
										<StartState>ActiveDeselected</StartState>
									</Select>
								</Elementtyp>
							</Element>
							<Element>
								<ID>element3</ID>
								<Ebene>2</Ebene>
								<Zeichnungsnummer>3</Zeichnungsnummer>
								<Position>
									<X-Position>0</X-Position>
									<Y-Position>200</Y-Position>
									<Width>250</Width>
									<Height>100</Height>
								</Position>
								<Elementtyp>
									<Klick>
										<ActiveImage>
											<URL>http://localhost:8080/clapsesy/GuiElementSeiten/KlickActive.html</URL>
										</ActiveImage>
										<InactiveImage>
											<URL>http://localhost:8080/clapsesy/GuiElementSeiten/KlickInactive.html</URL>
										</InactiveImage>
										<MouseOverImage>
											<URL>http://localhost:8080/clapsesy/GuiElementSeiten/KlickMouseOver.html</URL>
										</MouseOverImage>
										<StartState>Active</StartState>
									</Klick>
								</Elementtyp>
							</Element>
							<Element>
								<ID>element0</ID>
								<Ebene>1</Ebene>
								<Zeichnungsnummer>1</Zeichnungsnummer>
								<Position>
									<X-Position>0</X-Position>
									<Y-Position>0</Y-Position>
									<Width>250</Width>
									<Height>450</Height>
								</Position>
								<Elementtyp>
									<Content>
										<URL>http://localhost:8080/clapsesy/GuiElementSeiten/Content.html</URL>
									</Content>
								</Elementtyp>
							</Element>
						</Elemente>
					</Window>
				</AddWindow>
			</Operation>
		</ChangeGUI>
	</Type>
</GUI>