<?xml version="1.0" encoding="UTF-8" standalone="yes"?>
<GUI xmlns="GUI"
     xmlns:xsi="http://www.w3.org/2001/XMLSchema-instance"
     xsi:schemaLocation="GUIServer.xsd">
	<Version>1.0.0</Version>
	<SessionId></SessionId>
	<Type>
		<ChangeGUI>
			<Operation>
				<AddElement>
					<WindowID>window2</WindowID>
					<Element>
						<ID>element6</ID>
						<Ebene>3</Ebene>
						<Zeichnungsnummer>1</Zeichnungsnummer>
						<Position>
							<X-Position>0</X-Position>
							<Y-Position>500</Y-Position>
							<Width>100</Width>
							<Height>50</Height>
						</Position>
						<Elementtyp>
							<Button>
								<ActiveImage>
									<URL>http://localhost:8080/clapsesy/GuiElementSeiten/ButtonActive.html</URL>
								</ActiveImage>
								<InactiveImage>
									<URL>http://localhost:8080/clapsesy/GuiElementSeiten/ButtonInactive.html</URL>
								</InactiveImage>
								<MouseOverImage>
									<URL>http://localhost:8080/clapsesy/GuiElementSeiten/ButtonMouseOver.html</URL>
								</MouseOverImage>
								<PressedImage>
									<URL>http://localhost:8080/clapsesy/GuiElementSeiten/ButtonPressed.html</URL>
								</PressedImage>
								<StartState>Active</StartState>
							</Button>
						</Elementtyp>
					</Element>
				</AddElement>
			</Operation>
		</ChangeGUI>
	</Type>
</GUI>